{
    "full_name": "Florencja Pączusia",
    "email": "florcia.slodka@gmail.com",
    "phone": "+48501444223",
    "profile": "Czarownica z pasją do cukiernictwa i eliksirów smakowych. Od lat specjalizuję się w tworzeniu deserów magicznych, które poprawiają nastrój, przyspieszają regenerację energii i czasami... śpiewają. Szukam pracy, w której mogę rozwijać kreatywność i wnosić odrobinę słodyczy w codzienność.",
    "education": [
        {
            "school": "Szkoła Alchemii Smaku w Wypiekowie",
            "period": "Wrzesień 2010 - Czerwiec 2014",
            "description": [
                "Specjalizacja: Cukiernictwo magiczne i aromatyzacja zaklęć"
            ]
        }
    ],
    "experience": [
        {
            "title": "Mistrzyni wypieków magicznych, Cukiernia “Słodkie Zaklęcie”",
            "period": "2017-2025",
            "tasks": [
                "Tworzenie deserów o właściwościach emocjonalnych",
                "Opracowanie eliksiru “Cukier Spokoju”",
                "Szkolenie młodszych cukierników",
                "Magia aromatu i wizualnych efektów w ciastach",
                "Pomoc Kuchenna, Akademia Czarów w Migdałowicach"
            ]
        },
        {
            "title": "Przygotowanie posiłków dla uczniów magicznych",
            "period": "2014-2017",
            "tasks": [
                "Współpraca z mistrzami mikstur",
                "Praktyka w kuchni alchemicznej"
            ]
        }
    ],
    "skills": [
        "Magia smaków i zapachów",
        "Tworzenie eliksirów spożywczych",
        "Projektowanie wizualnych iluzji w potrawach",
        "Obsługa mikserów zaklętych i mioteł kuchennych"
    ],
    "languages": [
        "Wspólny — biegły",
        "Eliksiroński techniczny — podstawowy"
    ],
    "interests": [
        "Nowe przepisy, sztuka dekoracji tortów, kuchenne konkursy zaklęć, koty karmelowe."
    ],
    "footer": [
        "Wyrażam zgodę na przetwarzanie moich danych osobowych na potrzeby rekrutacji w dowolnej instytucji magicznej lub niemagicznej."
    ]
}