{
    "full_name": "Radan Żelazny",
    "email": "r.zelazny@postmag.org",
    "phone": "+48790009775",
    "profile": "Chatka Pod Wichrem, Zgierz Były strażnik graniczny magicznych terenów, z doświadczeniem w patrolach, ochronie artefaktów i walce z magicznymi istotami wysokiego ryzyka. Po latach służby szukam spokojniejszego zajęcia, które pozwoli mi wykorzystać praktyczne umiejętności terenowe. Twardy charakter, odporność na stres i znajomość natury sprawiają, że dobrze odnajduję się w leśnych rejonach i w pracy z młodszymi czarodziejami.",
    "education": [
        {
            "school": "Akademia Wojskowa Magii Obronnej",
            "period": "1993 – 1997",
            "description": [
                "Specjalizacja: Terenowe działania obronne i neutralizacja zagrożeń magicznych"
            ]
        }
    ],
    "experience": [
        {
            "title": "Starszy strażnik terenów magicznych / Gwardia ochrony Granicznej Magii",
            "period": "2022 – obecnie",
            "tasks": [
                "Dowodzenie patrolem zajmującym się utrzymaniem barier międzyświatowych",
                "Udział w akcjach przeciw nielegalnym łowcom artefaktów",
                "Szkolenie młodych strażników z zakresu przetrwania i walki w terenie"
            ]
        },
        {
            "title": "Asystent badawczy / Zakon Białego Kręgu",
            "period": "2001 – 2022",
            "tasks": [
                "Konsultacje przy tworzeniu systemów zabezpieczeń leśnych",
                "Praca z artefaktami ochronnymi o wysokim poziomie energii",
                "Doradztwo w zakresie bezpieczeństwa magicznych rezerwatów"
            ]
        },
        {
            "title": "Wolny Agent / Najemnik ochrony artefaktów",
            "period": "1997 – 2001",
            "tasks": [
                "Ochrona transportów magicznych przed sabotażem i kradzieżą",
                "Pomoc przy ewakuacjach podczas anomaly magicznych"
            ]
        }
    ],
    "skills": [
        "Zaawansowana walka magiczna i fizyczna",
        "Zaklęcia ochronne",
        "Tropienie i unieszkodliwianie stworzeń niebezpiecznych",
        "Dowodzenie i szkolenie młodszych czarodziejów",
        "Praca w ekstremalnych warunkach terenowych"
    ],
    "languages": [
        "Wspólny — biegły",
        "Techniczny runiczny — zaawansowany"
    ],
    "footer": [
        "Wyrażam zgodę na przetwarzanie moich danych osobowych na potrzeby rekrutacji w dowolnej instytucji magicznej lub niemagicznej."
    ]
}